subreddit,text
0,"Weird post, sorry....I have social anxiety, but due to unfortunate circumstances, I have to take a Lyft home this afternoon, by myself, and Ive never even taken the bus or a taxi before.  Can yall give me the run down about how to act? Do I tip? Is it cash only? Do I sit in the front or the back? Am I supposed to chat and make small talk? If I use a free ride credit, do yall still get paid?   Mods, delete if not allowed. "
0,"Option for non toll roads?Hi,  I wanted to take a lyft back home but it takes a toll road and there is a non toll highway that would get me there too. Is there an option for non toll highway and would it make it cheaper?   Thanks "
0,"Did you guys trust the 3-8pm ""busiest time"" for yesterday?So I worked it and it was dead slow, got 4 trips ($15) at the end of it I realised I should have just worked my usual hours 6pm-2am. Then it hit me, spring break just started so most of the drinkers are gone. "
1,"Help in understanding the sign-up processHey everyone,  I signed up for UberEats last week, and I’ve received a text saying my account is all set and I’m ready to go. I’ve uploaded all the required documents and everything. I have a couple questions.   Am I signed up for bother UberEats and Uber? Because, when I go to sign up for Uber it appears to involve the same steps. My second question is, my account is supposed to be active, yet when I look for the options to set trip/order preferences like I’m told I should be able to based on what I’ve seen online,  I don’t have those options available.   I’ve uninstalled and reinstalled the app already, didn’t help. I also tried to contact customer support but it says a verification was sent to my email that I need to confirm, but I haven’t received it, and there’s no option to resend it. It also says online that there’s 24-hour driver support by phone too, which is accessed in the app, and I don’t have that option either. So, overall I’m just a little confused. If anyone can help it would be much appreciated. "
1,"MY SHOEOk, so today I had to get an Uber for a Doctors appointment for my kid and I because I thought the appointment was later than it was. So we go immediately to try and make it on time.  This guy pulls up and as I am getting my kid in the car, the car starts moving forward and Im instantly thinking this guy is gonna kidnap my baby girl.  So panicking Im lunging forward to try and grab her and the car stops. His miatake. Ok. Phew. It was only a few seconds but it seemed like forever. Well long story short, the guy rolled on to my shoe. Like he had to reverse off of my shoe because the car was on top of it. Luckily my shoe was a bit larger than my foot, because I almost lost my toes!"
1,What were the most important strategies that Uber used to not get banned early on for violating regulations? 
0,"I got 1 starred for talking about politics during the ride. Is that not cool anymore?When I used to live in New York, that was all I would talk about with my taxi drivers. "
1,"240 miles and only got 100 bucks.This isnt right, sure its only 120 mile one way, but we need to go home as well = 240 miles on the car.  .41 cents per mile!  That means before car repairs / tires / oil changes / insurance a brand new car will only make 41,000 dollars before hitting 100k miles.  How is it worth it?  I imagine even not taking long trips it has to be similar because you always have to go home eventually, but yes it would be a circle rather than a straight line, so maybe it would be 50 cents a mile rather than .41 cents.  What am i not figuring out properly?"
1,"To all the folks whove tipped me in the appThank you  Im sitting here at day job &amp; looked at my phone.  Notification from uber saying You received a tip!.  So, I went into the app, to look up the trip.  It was that guy I drove from one train station to another last night.  But, it just as easily could have been the pool passenger I picked up from that train station.  Or one of the passengers over the weekend.  Anyway, after I saw who it was, I thought (as I always do), Aww, that was nice of him.  And I wished that I could thank him.  But, the app doesnt have any option for me to acknowledge a tip.  So, I thought Id put it out here.  To those of you who tip $1 or $2 or $5 or $20 or any other amount, thank you for thinking of me.   I dont expect it at all.  But, I truly appreciate it when I get that notification saying a tip was added.  It makes me happy to have been able to help you get where you needed to go.   Im clearly out here ubering for extra money.  So, when you give me a little bit more, it really makes my day!"
1,"Question about background checkHey guys, I just started my application to drive for Uber. I put up pictures of my license, insurance, registration, eligibility of work and myself. Now they are asking for a safety inspection certificate (applying in Toronto).  Needed to know if they do a background check with the info I have already submitted? I had an accident and speeding ticket back in 2014 (the only 2 infractions on my record) I would hate to spend money on a certificate only to be rejected later. Any advice would be helpful "
1,"Screw you Uber, I want to leave mega-tipsMy wife went out of town. I am drinking a lot, and thats just that. I took an uber to the local Liquor Store. If I want to leave an 80.00 dollar tip that is MY CHOICE not yours you bastards. Uber saved me from a DUI, because my rear view mirror was out. My driver Mark shouldnt have to suffer from my inability to pay in cash like a freaking CAVEMAN. Fix this shit. If I want to tip my amount let ME DO SO!"
0,"Just quit my retail job to drive full-time!This post isnt meant to glorify quitting your day job to become a full time driver. I just wanted to share my personal experience.     Ive been working a dead-end retail job for almost the past year where Im underpaid and have been turned down for promotions. Im a hard worker and basically have just been taken advantage of. Today I decided I had enough and turned in my work keys and left. I know its risky but I just felt that it was a risk I needed to take, especially for my mental health as this job just absolutely sucked my soul.     So, heres to the future! I know theres still a lot to learn about driving full time but Im going to do the best. The most stressful part is trying to tax myself so I have money for next tax season, and keeping track of my mileage. But I believe it will be completely worth it for now. If anyone has tips or advice Id love to hear it!   Edit: Im only doing this temporarily for 3/4 months while searching for a new job. Seem to be getting lots of hate for no reason "
0,"Phantom rides, delayed pickupOften when I request a ride Lyft shows me a normal-looking name, face and license plate with the message that my ride will be here in (for example) 4 minutes. Then, while Im standing on the sidewalk waiting I get a new message with a different name, face, and license plate and new arrival time estimate farther in the future. Sometimes this happens three times before a car arrives, 10 or more minutes later than the original prediction.   I switched to Lyft (from Uber) in January because friends told me Lyft is a more humane employer, but I am finding Lyft unreliable. The broken promises about when my car will show up remind me why I stopped using taxis.   I am in Los Angeles. Is this typical of riding Lyft here?"
1,"Ubers idiotic signup broke my accountSo I decided I wanted to try uber eats with my bicycle. Seemed simple enough. But as I was making my account I accidentally hit the using a car button instead of a bicycle. No big deal right? Just go back and select the bike option right? Welllllllll no uber doesn’t have that option. Like literally they don’t have a back option for that and every-time you try to hit the work for uber option it brings you right back where you left off no matter what. I went into a live chat and they literally told me that there is NO option to go back and that the account is now useless. (Fun fact, you can’t delete the account if its connected to an email according to the guy). So what? Just make a new account right? Use another email right? Welllllll... kinda. So I did that. But guess what? If you use one phone number for uber you can’t log in to any other account using that phone number. It just... wont let you. So if I wanted to make another account (my third at this point) I would have to change my phone number.   Now here is another funny thing. I decided that maybe I should change my password for one account so it wont bring me back the the first broken account so it could differentiate between the two while logging in. Buuuuut no uber thinks now that I ONLY want to log in to the useless account that I can’t change. So because I used the same phone number it broke the system and changed the other password and now both passwords show up as wrong for each account. Even when I change the password it brings me to a verify email screen and then brings me back to the login with my phone number and says the password is wrong.   Note that all this could have been avoided if the added a go back option in the setup for wether i’m using a vehicle or not. "
1,Charged a wait fee but climbed in the car within 10 seconds. 
0,"Driver CancelledWhile I was standing in the rain three days after eye surgery needing a ride home.  The app showed him at my pick up location but then he calls to say itll be at least another 5 minutes.  When I asked where he was because it was pouring rain and he was asking about a hotel several blocks away, he hung up and apparently cancelled the ride.  Ive never had this happen before and I dont think Id use this service again, especially in a critical situation where I need a ride like today."
0,follow up text from lyft reminding me to tip. love it. is this new? or have i just not ridden in awhile? 
0,Am I missing something or is it still shitHave not driven for a Lyft in awhile and heres what Im not seeing:  A full address. Why is the name of the city a secret?   The ability to hide my earnings  The ability to text in the app 
0,"Are Lyft drivers notified about a long trip before accepting?I know with Uber there is a long trip alert that tells the driver the trip is over 45minutes. I was wondering what kind of notification Lyft drivers get. If there is does it give the actual trip length and/or destination or just a generic ""over 45 minutes"" notice like Uber?   Im asking because I have a 2 hour ride coming up and want to know if I need to call the driver to let them know or if the app will tell them where Im going before they accept.   Also, if I call and they dont want to take the long trip whos responsibility is it to cancel the ride? "
1,"Calling uber for someone else in AustraliaHey everyone!    I was looking for ways to call an uber for someone else, and I was happy to find that its a well-supported feature. I went to the app to test it out (the person in question will need it in a few hours), but the option to select the person taking the ride is missing (it was shown on news articles, youtube videos showcasing the feature etc.). Is it something that might not be available in Australia, or they changed how it works?    I know we can set up a family account, and Im OK with that, but Im curious if Im just clumsy or this feature doesnt work in AU (or its been disabled? the articles are from 2017)?"
1,"Uber eats delivers right outside of my gated subdivision.It says it cant deliver to my house, but if I were to step outside and walk a short bit. It would deliver. Is that ok if I order the food and have them hand it to me instead of coming to my door."
1,"Additional Charge questionNot sure if this is the right place to post this. But the Uber I took last week in a different city charged me an extra 100$ for cleaning. When I inquired what sort of cleaning, Uber customer support sent me a picture of vomit on the car floor. Now this was a 4 min trip from a conference center to the holtel I was staying in.    This was a work trip and so I was obviously not drunk and did not vomit during that trip. How do I get this wrongful charge off my card?  Edit: Contacted Uber and told them that this wasnt me and either Im being charged for another customers fault or this is fraudulent. Had a couple of emails back and forth but they refunded me the cleaning amount."
0,"Turn down the radioIf you’re talking to your passenger.  I’m a driver, but a pax tonight.  My driver kept trying to talk to me, but I couldn’t hear over his shitty music. Not a great ride.  "
1,"Why do drivers sit in one spot?So this has been happening more frequently lately. Whenever I order a ride, and the driver is completing a nearby stop, they tend to sit there after the ride is complete for like ten minutes. The car icon just spins in place. For awhile I thought my map was just glitched. But then they start going eventually to come pick me up. Any reason why this happens?"
0,Oh Boy this guy gonna have to sue the city 
0,Driver gets denied claim and Lyft Refuses further help.[https://imgur.com/gallery/1mSWgWq](https://imgur.com/gallery/1mSWgWq)
1,"Hey guys. Ive been thinking of trying working for Uber but I have some questionsI currently work as a truck driver but as one of the newer guys its going to take a while before I gain seniority and more hours. Would I make enough as an Uber/lyft/delivery driver to pay for a car loan and related expenses? My schedule at work is quite odd so I cant find a part time job that I can work around those hours. Doing this would be a good option because I can work flexibly, as long as I could pay for it and still have money left over.  P. S I live in Hamilton, Ontario, Canada if that matters."
1,"Riders, is the look of a car important vs how clean it is inside?I ask this question because my Toyota Camry engine went and was too expensive to fix so I bought a buffer car to save up for what I really want. My buffer car is a 2004 Chrysler Sebring. Very clean and got lucky with it at 54k miles only. I’ve already been approved by lyft and waiting on Uber.   My concern is on the outside the paint is dulling a little in some spots because the age of the vehicle. Can’t see at first glance unless you really inspect it. Car drives good, breaks amazingly, very smooth. Inside is clean and smell good. I’m just afraid because I don’t want my rating to take a nose dive because the paint isn’t the best looking on the outside upon inspection.   I wanted to know if something like this would affect your rating with a driver because of that? Would love your honest opinion on this. Thanks. "
0,"My first friday night out, is this what i should expect? "
1,"He Had a Stroke -- My Uber Story*Hi everyone, I am an Uber driver who likes to share my stories from the road.  I find we see so many interesting things in a day and meet such interesting people.  Driving has certainly helped restore some of my faith in humanity as I find the vast majority of riders are kind and have great life experience to share.  I know we always seem to hear about the horrible riders that cause us grief, but I think there is a positive light out there for drivers that very few people get to see.*     **He Had a Stroke**  I generally don’t get the chance to drive in the morning, but when I do, I find people are generally just going about their business. To a meeting, to school, back from the train station. You get the picture. Today was different when I was pinged by the app to go pickup at the hospital. A middle-aged gentleman was already waiting outside, which I always appreciate. The uncertainty of driving for an app is always put at ease when a friendly face is standing there waiting for you. The human connection is always nice to see and I much prefer it to a computer telling me when and where to show up.  We started to talk about the weather. The art of small talk is something I believe I have mastered, but my most interesting rides are always the ones that go far past these social norms. The conversation turned sharply as he said that he did not get to see much of the winter this year. My mind rushed to a long-term winter escape. Florida perhaps. So, silly me, I asked away.  “Did you get away for the winter? Lucky you!”.  “No, unfortunately not. I was in the hospital. You see, I had a stroke”.  Knowing very little about strokes or really what to even say, I wished him well in his recovery. We chatted about life, the recovery time, the agony of the doctor’s uncertainty. When could he return to work? Is this even in the cards any more? His entire being had changed in one moment. I suppose life is just a string of how we are doing today, this week, this month, this year. We forget how terrible it used to be when we struggled with a situation or event. With a medical issue, the loss of your first boyfriend or girlfriend, or even how shitty homework was to do in high school. Humans forget too easily and perhaps this is a helpful coping mechanism.  [https://medium.com/@theridesharestory/he-had-a-stroke-6970624fcd0](https://medium.com/@theridesharestory/he-had-a-stroke-6970624fcd0)"
1,"Uber and Lyft getting on my last nervesFor the last 2 days I’ve had a driver cancel on me after waiting 20 minutes for the uber, which I have no doubt that he cancelled once he saw he had to go into UCF. They should be penalized or uber should cover my fee. Also what’s this bs about drivers starting the wait time? Had a driver start it before turning in to pick me up, and then miss the pickup and had to turn around. There are a lot of bad drivers out there, and people who don’t care. Is there another service I can use? Im talking about both uber and Lyft, they’ve become unbearable "
1,"New number and now I cant access my account.I cant access my uber account cause I have a new phone number so I cant received the 4 digit codes they send via SMS.  They dont do a “email reset” cause with my email that new number is not linked.   I forgot my password so Im trying all ways to access the account and I cant! Nothing works. Someone help me.   Any suggestions?   Edit:  after struggling for like 2 hrs I solved it! Fucking a, this was making me nuts."
0,"IMPORTANT:Attempted Lyft Scam while drivingToday while driving toward a passenger named Duc, I get a phone call from a 424 area code and I hit the button to decline the call with a text. I received a second call which I declined as well. On the third call, I pull over and accepted assuming the passenger has something important he wants to communicate with me. The caller says he is from ""Lyft passenger services department ""and that a recent passenger has reported that I have been using my cell phone while driving, which I very rarely have done. He says that he has to put a suspension on my account and that the company has already notified the passenger. He confirms the year, model, and color of my car along with my license plate number. I protest the use of my cellphone while driving and the caller states that if I have a dashcam, then I can send in the footage. He seems to backtrack and says that he can lift the suspension on my account. Then he says that he has sent a code to my phone and asks me to confirm it. Seconds later there is a text from Lyft with a code which I repeat to him. He then asks how many rides I have given this week and my balance. I estimated the rides, which were only a few as well and give him my balance. Which he seems upset about. The caller then tells me to cancel the upcoming ride on my phone which I do. Then the caller gets irritated and says that I need to log out of the system and ""Dont log in ever again! Ever!"" And then the phone went silent. I was confused and upset. A few moments later, I get a ride from another passenger and the ride is immediately cancelled. I am thinking Lyft cancelled the ride. I ended confused and looked again at the text from Lyft and it read ""please keep in private and do not give to anyone."" I drive down to the Lyft hub and spoke to the representative. She told me LYFT WILL NEVER CALL A DRIVER, THEY WILL ONLY EMAIL. She also said that another driver recently reported this today, but never heard of this before that. She also confirmed that the 424 area code is not an area code that Lyft uses. The representative was also not able to look up the customer, as it was a cancelled ride. The code I gave the caller was a login code, so she had a tech support log me out and re-enter all my banking info. Since it was not a Lyft phone call, I was wondering how they got my phone number. I figure the scammer booked a ride and was able to get my name and vehicle number. Somehow he had my phone number which he was using to log into the driver database. Then he got the login code from me. I am guessing he was looking for me to confirm I had more money in my account,and then he was going to change the bank deposit info and cash out my ride earnings for the week before they get automatically deposited into my account. PLEASE BEWARE OF THIS SCAM!! It was somewhat smooth as the caller was able to confirm several pieces of data including that I was currently on a pick up, which made him sound more legitamate, including having a text sent to my phone. As I look back, he changed his story about the suspension on my account and seemed upset at my account balance."
0,"Failed background check?I had a misdemeanor that is now expunged however I still was flagged on my background check :(. I really want to drive for lyft. I drive for Uber now and basically have a 5 star rating with over 600 trips completed. There must be some way that I can be given a chance the drive for this platform. Any advice is greatly appreciated. This is my lively hood and it’s how I pay my bills. I would really love to be able to drive for both lyft and Uber. Thank you all in advice.   My best, Diab K"
1,Can someone explain to me how uber cash works?[it says I have $5.00 if it.](https://imgur.com/a/4FiFVdi) How do I use it?  Does it charge five bucks off the reward thing then charges the rest on my card. All I could find on the internet is paying uber rides in cash.
1,Uber Driver Reports Would-Be Bank Robbers 
1,"I constantly get this error. I need a ride for work tomorrow and am trying to schedule it. Lyft works in a pinch, but uber just doesnt work for scheduling at all. Help? "
1,Alcoholic mother in law just got a DWI and is driving for Uber again. Customer service was useless and kept repeating that “the owner of the account needs to contact us”. What can I do? 
0,"Weird issue. Scam or something else?Im kind of new to Lyft, though I dont think that matters too much. I drive Lyft in a college town. I dont use the other service. Ive never been a rider.  I got a ping, good ways out of town. About 5 minutes. Okay, I thought, this should pay well. When I got there, my app glitched out and acted like I picked up the rider, and started directing me to their destination. So I tap the riders name and theres an option to call. It asks if Im sure I want to call the rider in my car, I say yes and it puts me through. She sounds confused. I say Im her Lyft driver and Im having a hard time spotting her. She says shes in her Lyft and she doesnt know what Im talking about. I wish her a good evening and apologize for the confusion. I assume Lyft double booked her ride and I dont worry about it too much.  So I drive back into town, and just as I get back into town she sends me another ride request. Well, she didnt send it to me specifically, but it came up on my screen. So, she told me she was in a Lyft and going to her destination... what would you do? Go back out there, run down the clock, and get $5 for a cancellation? I didnt get $5 for the first cancellation. So I declined it. And then couldnt get any riders for the next hour, though, it may have just been slow.  I had a good day compared to what Ive been having (but nothing like some of you folks!) so I really cant complain. But my acceptance rate went down from 100%, now its at 95%.  Should I bother Lyft with getting it fixed or just let it ride? Or does this sound like something where maybe I misread the situation and maybe I screwed up somehow? I cant help but feel like she was doing something improper. If she had just cancelled on me and then sent another request, I probably would have just gone back (again, it was slow), but what tripped me up was that she told me she got in another Lyft. So if thats true — and why would Lyft send two drivers way out of town, anyway? — why would she need another ride from her home? Same name, same address. No profile pic in either case."
0,"How to deal with MUSTY PASSENGERS? /RantToday I had 3 passengers who were pretty musty and it was quite unpleasant.   Pax #1:  polite man but extremely musty. His body odor was so strong I could smell him from the back seat. He tried to sit in the front but I had a lot of personal items so he just decided to sit in the back. His scent was so offensive that I had to drive with the windows down. It was a shared ride too so I can only imagine how the other pax felt lol  Pax #2: nice woman but musty. Not as bad as the first guy but still bad enough to notice. I could tell she did not shower that day.  Pax #3: shy polite girl but smelled gross. I had to look back to see if she had any food in the car, but nope, it was just her musty ass! I had to air my car out for 5 minutes after she left.   Do yall just 1 star these MFs? Everyones money is green but I dont know if I can tolerate that, especially when none of them tip either. "
