subreddit,text
0,Nightlife PlaylistI usually drive people going out to clubs. I want to make a playlist for those passengers but Im out of touch with the nightlife scene nowadays. Im looking for a rap/hip hop vibe.   So far what I have is: 1. Nice for What - Drake 2. No Mediocre (feat. Iggy Azalea) - T.I. 3. So Excited (feat. Dre) - Fat Joe 4. Truffle Butter (feat. Drake &amp; Lil Wayne) - Nicki Minaj 5. Taste (feat. Offset) - Tyga 6. Getcha Roll On (feat. Tory Lanes) - T-Pain  Im open to any suggestions
1,"Uber should add this feature to their app to make it more safe...A woman was killed after mistaking someone else as her uber driver.  One way to prevent this is to add a feature to the app to let the uber passengers know that their uber driver has arrived.  Basically, before any uber user goes inside the car, they should get a message in their app saying that their driver has arrived AND that the drivers can see their passengers outside the car.  Had this feature been on the app, the woman would not have gone inside the wrong car."
1,"Interest in starting but I drive a JeepI want to start as a side business. I provide free solar as well in Southern California, Corona but I’m just getting started with that. Doesn’t anyone Uber with a Jeep? Mines a 4 door 2013 "
0,"Uber or Lyft while vacationingSo, I would like to start doing Uber or Lyft in my car, specifically so I could road trip and still be able to make money.   However, I have heard something about how you have to be registered a drive in a certain area only. I have also heard that some states, like NJ, you cant drive for other states like NY. But NY drivers can drive in NJ.  Anybody have experience being an Uber or Lyft driver all over the US?"
0,"I got co-erced into getting someone a Lyft, what are my options?To make a long story short, I was co-erced and sexually harassed/threatened by a drunk stranger at a bar. I was cornered and the bar security eventually got to him but by the time they did the Lyft had arrived. This stranger ended up burning a small hole in the drivers seat with a cigarette as he got into the car, so now I am being charged damages. I have tried to contact Lyft about this but havent gotten a response.    For context, I am a 52"" female who was just trying to enjoy the Super Bowl at a local dive bar that Im a regular at. This guy had me physically cornered and watched everything I did on my phone so I felt like calling the police wasnt an option but I did try to ask the Lyft driver through messages to call police and explain the situation to which he basically said ""tough shit, I cant do anything"".    Do I have any options here or am I going to be eating this $150 fee regardless of the situation? Are there any legal options I can take against this person? I am not looking for sympathy, only answers."
1,"Is Uber accepting salvage cars these days?There is a place near me called East Side Auto that sells hail damaged salvage cars of new years, but mechanically everything runs well.  Cosmetically hail is usually very visible on the roof of the car but pax never look at roof.  I wanna buy one of the hail damaged cars, but there is no returning once I buy it so am curious."
1,"I was able to get voice control working on my android One Plus Phone and was able to talk and say tap 7 for the Uber Go Button. I did this because of a ticket I got that cost me $225 for touching my phones screen to accept Airport ping.That ticket taught me a lesson, the law doesnt care if youre driving Uber.  Because of the texting deaths in Minnesota, they are strict about anyone touching a phone screen, so now am happy I can voice control this thing.   **Here is the harsh ticket I got, for extra money they allowed it to stay off my driving record which is good because I dont want insurance to go up on me** https://imgur.com/a/oNntLev  **Here are the screenshots of me operating the Uber with just Voice Control** https://imgur.com/a/V6fiSGA     With the voice control all objects and apps are assigned numbers, and those numbers never change, for Uber it is 8.  All I have to say is 8 to open the Uber app, and then say number 7 to hit the Go button.  The decline button will have its own number too.  This is a Google made app called Voice Access which is available free on app store.   For you iPhone guys, there may be another app that can do this too or maybe Siri can do it.    The hearing officer for my ticket said regardless of Uber, the driver must pull over to accept a ping and that cant happen on a freeway where I can cause a hazard if I pull over or in most city streets where there are parked cars and nowhere for me to pull over (especially in downtown), unless in city I pull over to gas station.  But with the voice control thing I got going, I wont need to touch or look at phone screen, I will just interact with it via voice and have it auto navigate.   Just to make back that $225 I had to drive at hours and times I didnt normally work.  So I essentially drove for free thanks to the ticket.  They are really cracking down on texting and driving and this means anyone touching their phone screen even if they are not touching, cops dont care as they will still give you ticket despite you the Uber driver just accepting a ping and not actually texting.  http://www.startribune.com/texting-while-driving-citations-in-minnesota-jump-30-percent/504803162/"
1,Uber driver pleads guilty to kidnapping passenger 
1,Is there a way to find out what date you first became an Uber driver? 
0,Lyft 
1,"Uber drivers expecting tip for 5 stars?Recently stopped tipping every ride because im in a bad spot financially and only tip uberpools. In direct conjunction with this my uber rating has started dropping. Are yall as drivers expecting us to tip to get a five star rating? Nothing has changed about how i take ubers. Still waiting at the curb as they appear, still friendly but keep to myself unless the driver talks to me. Been taking uber regularly for a good 5 years now. Original rating was a 4.88 and after i stopped tipping it started dropping to 4.7."
0,Acceptance rateWill Lyft deactivate you for a low acceptance rate? Or just too many ride cancellations?
1,"Anybody else not get their 1099 yet?I should preface this by saying I deleted my partner account with Uber mid-January (I drove for them for several months in 18), but I dont see how deleting my account would affect me getting my 1099 when I selected e-delivery for my form when I signed up.  Its not like they wouldnt still have my information stored.    I realize I can just look up the deposits on my bank account and file that way, and I probably will end up doing it that way, but if I had known Uber was going to not send me one I wouldve started retracing my deposits already.  And I cant find a number or e-mail where I can reach them on the website because my account no longer exists.  What a goofball company."
0,"How do I get reimbursement for EZ-Pass?I picked up a passenger from airport and went through EZ-PASS lane because thats where app guided me to. When I received the a ticket via mail, I paid the fee and then submitted the receipt to Lyft. This is what they said:  I do apologize for not getting back to you sooner. Right now, I am following up on your feedback about this toll.  I appreciate you providing us with this review about this toll, however, after having looked into your account, I was not able to locate any ride given on Mar 8. 2019 around 10 AM.  Please, keep in mind that the tolls incurred during the active rides (between the pickup and drop-off locations) should be paid by the drivers and later Lyft reimburses the paid amount based on the electronic toll collection system price.  This is normally less expensive than the cash price and other payment options (such as cash, by mail, by plate, etc).  Its recommendable to pay tolls with an in-state electronic toll collection system, like FasTrak, TollTag, or EZ-Tag, because it will ensure that youre not paying additional money for tolls and then get reimbursed the correct amount.  These systems give your passengers a smooth, fast experience when going through tolls. Theyre also the safer option, as you wont be required to carry cash.  That being said, the only amount we could be able to reimburse you for these tolls is the one paid with tag/transponder.  Observe that some roadways have optional express or HOV Lanes, which charge a fee for their use. Lyft’s toll policy does not reimburse drivers or charge passengers for using these lanes.  When on a ride with a passenger, you will want to use the lanes where an additional toll is not required.  If a passenger request for you to drive in the Express Lanes, you can kindly let them know the Express Lanes are not included in the Lyft ride.  For more information about Lyfts toll policy, please visit the article on our Help Center at How tolls work for drivers.  Since were unable to reimburse for any penalty toll fees, in the case that you get a ticket, it is highly advisable reaching out to the toll authority directly to see if they can offer any help.  thank you for your understanding and your commitment to the Lyft community. Dont hesitate to email us, if you need further assistance.  See you on the road""  The time theyre talking about is the time they sent me the ticket from EZ-Pass."
1,My Uber account has been deactivated for no reason and they are now asking for my card details to unban it? Is this normal? 
1,"UberEats threaten deactivation(Screenshots in comments). Repost from /UberEats  Okay, so I order a McDonalds through UberEats in the UK as we dont have McDelivery in our area. Its always a hit or miss when ordering from them as they usually forget an item or youll get a driver driving carelessly. Ive had to request a refund a few times which Ill go over below;  1. Have had a driver with a low rating that spilled our drinks (coffee, diet coke) in the bag and cursed on the way up the stairs as he realised what was happening to the bag.. he was holding the bottom of the bag before passing it to us before quickly heading away. The bag burst in my livingroom and ruined the carpets as it was literally a bag of liquids. I had to notify UberEats and sent photos of the damage and they only refunded me the drinks (we ordered about £15 worth of food which got ruined also).  2. I ordered pancakes with double sausage and a sausage mcmuffin and only received pancakes and the muffin was burnt. It cost extra to have pancakes and sausage nevermind extra sausage so I told them about this and took photos. They refunded me 40p for the extra sausage which I tried to explain to them I never received the actual sausage nevermind the extra one.   3. This time was from Subway, I ordered a foot long meatball marinara and they sent a completely different sub which I couldnt eat and they refunded me.  Now, my Grandmother (a different debit card was used) ordered a McDonalds through my app as I was visiting her and she ordered her food and told me she ordered before and stuff didnt come and I told her they can be like that. We ordered £25 worth of food and she didnt get 2 chocolate muffins which I informed UberEats about and they sent me this message, I explained to them its a different card used so Im not ""scamming"" them and they told me I would get my account deactivated. My grandmother is retired and gets money off a pension so it may not seem a lot to lose but its her money. I wouldnt need to request refunds when the case is the restaurant and their drivers being careless.    "
0,"Hit and run, property damage. How to proceed?Hey Lyft!  I used the service for the very first time over the weekend. After we got dropped off Saturday night my fiancé noticed our driver hanging out in front of our house for an extended period of time looking at the rear of his car. She thought nothing of it as we live on a steep hill and thought he may have scraped when leaving. Well today we saw where he actually clipped the end of a brick retaining wall and destroyed the brick masonry on the last 2 feet of the wall. No call, doorbell ring, nothing. We already emailed lyft and are waiting to hear back. Basically, what are we in for?  Any chance we get the repair covered?  Any advice?  Thanks!"
1,"Car and plates didnt matchHi, I requested an uber today, got a call from the driver asking if I could see him and saying that hes right in front of me behind some people. The car was different from the one in the app. I checked the plates and they did not match either. I asked him to open the window and communicated my concern about the car and the plates. He said that he has just bough this car and they havent updated the information. I declined, he asked if I wanted him to cancel and I said ""yes"". Would someone consider it safe to take uber even if the car is different? Why would a driver still take passengers in this situation?"
0,"Need help!!So guys im trying to drop off and pick up my friend to San Francisco downtown (about $79 during prime time), i was able to do it for 3 times but after that we just cant seem to get matched. Tried it for about 20 or more times but never got the ride request from him even if he is right next to me in the car.  Is there reason behind it? How can this be fixed? Is it lyft policy? Any help will be appreciated. "
0,Lyft is giving people bonus for yesterday downtime. 
0,"I thought I did the right thing by my driver.So I requested a ride from an oil change place to my apartment which wasnt far. I didnt realize I went to a quick oil change place and they finished my truck insanely fast. Right when they announced they were basically done, my driver shows up. I should have cancelled on him but I waved him down, told him I didnt need the ride, gave him 5 bucks for his time and told him if he could cancel for me, cause I couldnt find the cancel button.    Driver charged me a no show fee on top of the Fiver I gave him. Lesson learned I guess.."
0,"Any tips for first time rider?Hello everyone!  So today my car broke down and I don’t know when I’ll be able to get it fixed but that’s not the point. I have an order I’m supposed to pick up on the 29th and was thinking of taking Lyft to get there. The store is 7 minutes away from my house if you drive but it would be too far to walk. The charge is $3.42 with the discount for the first 10 rides which brings me to my first question, does this take away from the drivers total and is there any way I can get rid of the discount if it does? I don’t want to hurt someone out of their living.  Second, if I want a round trip do I have to order two separate lyfts? This is my first time using the service so I have no clue how it works.  Third, what should I tip my driver? I imagine it would be better to tip them in cash rather through the app or maybe I’m just old fashioned but what’s a good tip protocol?  I’d love to hear from both drivers and passengers! Thanks in advance.  TL;DR  What are some tips for a first time passenger? Does the first 10 rides discount hurt the driver? Do I have to order two separate lyfts for a round trip? What’s a good tip protocol?"
0,"Why is my Lyft earnings in the negatives?This morning my earnings were listed as like -$3,000.00   Why?!?!?"
0,"Question for transgender drivers do you need to have your legal name changed to have your profile display your preferred name?I have a friend who is transgender but hasnt changed their name legally yet, will lyft let her drive using her preferred name or will her profile always show her legal name?"
0,"Destination unreachable. Lyft stole about $30 from me.Took pax to airport. GPS was acting up sending me to weird routes. Pax mentions that happened before so I drove to airport and told pax I would need to leave him at his real destination but continue driving to complete the route. As I drove 7 extra miles I see that the destination point is unreachable as gps was pointing to a dilapidated road behind a fence. I didn’t know what to do so I took some SC and has to cancel the ride as I didn’t saw any other option. I contacted Lyft with the details and they won’t pay me because I canceled the ride. They say to use Drop off next time. I need to find that option. Lyft CS is terrible, I didn’t expect much but is the second time the let me down and now straight robbing me. I hope I can find a real job soon."
0,Lyft gives up debut gains in second day of trading 
0,Anyone else recently get this email with an almost too-good-to-be-true offer? (See comment.) 
0,Scam or not? I got this message a few minutes ago. I drive a 2012 Audi Q7 and thought it was one year too old in my market for LuxBlack..did the requirements change in the Bay Area? I’m afraid to click the link and it hasn’t been updated in the app. 
0,"""Ill tip you in the app""Why do people feel the need to lie about this? I had a long ride yesterday. Took the PAX 215 miles from the local airport to their destination, in the mountains, through snowstorms. I drive a dodge dart, Not exactly ideal for the conditions. I considered stopping mid way through and ending the ride for the sake of me making it home safely but decided to carry on and get the person to their destination cause im a nice guy. The PAX said several times during the trip they would give me a hefty tip. 4 1/2 hours later hes where he needs to be and I start my trip back home which is another 4 hour drive.   Today is the next day, and surprise surprise, no tip. PAX even reminded me one more time as he was leaving my car that he would leave me a good tip. People that act like this just make feel like doing [this](https://i.imgur.com/aYP6MB9.png)  and yeah, I know, it was a long ride and I got good pay for it anyway so why the complaint, Well, the ride is a recent example of me going out of my way to help someone and still getting an empty promise. People claim they will tip and dont all the time on various types of rides and its annoying."
0,How do you call support?I keep requesting to have them call me and it won’t come through. The calls never do. Does anyone else have this issue?
0,Shared rides get 4 min waiting time now.Great move Lyft
0,"This is why I feel like ""45+ Minutes"" isnt accurate enough. It shouldve warned me ""2+ Hours"" "
1,Need to figure out a way to circumvent underage unaccompanied riders BSHad a smart ass underage account holder attempt to convince me transport him this A M. Going to school. Took me 15 minutes to circumnavigate a 6 minute ETA pickup. I do not transport minors. He admitted to 15. Told me the tired old line about everyone else does. Told him it was not a debatable issue. Then demanded I cancel. I told him it is his illegal account it was his chore to cancel and fight with Uber. I did not start trip and was 3 minutes short of the timer. Want to go back online. I drove off and cancelled.  2 minutes later same clown  pinged me and followed it up with a request for cancel. Different address same account I drove for another 5 minutes and ended up cancelling to free up my online status. Contacted Uber support this afternoon and got my 3.90 cancel fee and was unpaired. Is there a better way too deal with this shit from pax? 
0,"Will I know if/when a driver agrees to take my scheduled ride?I scheduled a ride for tomorrow morning, last night. In the scheduled area tab it shows my ride and says ""you will be notified when your driver confirms"". Does that mean the morning of my ride I will get a notification when their on their way? I really wanted to just know if I will be able to know if a driver has already accepted my scheduled ride or not?"
0,Women Disturbed After Lyft Driver Shows Up Without Pants 
1,"Best way to bring cats?I have to bring two cats (in carriers) to the vet at 6am so not many Ubers are in my area. Its a ~5 minute drive. I plan to choose Uber XL, ask the driver of it is okay, and also tell them I will tip an extra $10 as it is an abnormal request. Anything else I can do to make the driver happy/okay with this, you think?"
0,"Whats all this about a strike?I just got a new car (4-door upgrade from my old 2-door) and was thinking about doing some driving for Lyft to make a little extra cash on the side after work, but the first thing I see when I come to this sub to poke around and ask questions is apparently theres a big strike going on. Quick google later and apparently there are big pay cuts that have happened/are about to happen? From what I can tell its only in Orange County but its still a little troubling. I dont want to go through the trouble of getting started with something that pays peanuts. I see people making hundreds of dollars in a night but Im guessing those are metro areas; I live in New Hampshire, so I cant necessarily count on volume making up for lower per-passenger earnings."
1,I am a Tax Accountant and Uber should not report incentives as a non employee compensation in box 7 on a 1099-Misc. They should report it as other income in box 3 not subject to Self employment income.*Self employment Tax 
1,Monday as a Diamond member of Uber using a Hyrecar. 
0,What kind of music and how loud do you play it? Do you prefer passengers sit in the front or back? Any go to comment to get a tip? 
1,"How would someone go about escalating a health and safety matter?approximately a week ago, i noticed multiple adult head lice on the headrest of the seat in my uber, i sent a picture of 2 the lice to uber, and informed the driver, he ensured me hed make sure he immediately delouse his car. i have only his word that he did that, but no reason to doubt him, he seemed just as shocked and alarmed as I.  however a week later i have found baby lice pop up, either one i didnt notice got in my hair, or there were also eggs on the headrest (i didnt notice the lice till half way into a long trip) and some slightly larger ones in my own hair, and uber offers nothing but cookie cutter responses.  with my hair length i need treatment, and new bed linens and other material stuff that has become potentially lousy, and every time i ask for some help with compensation as i do not have the money for it at the time, uber ignores that portion of the question. i have reported it since the moment it happened, then the moment it affected me, but uber in app help either is incapable of understanding or just doesnt understand that its unacceptable to acquire a parasite from using a paid service. and a health and safety risk, as well as plain disgusting.  if someone got hit by an uber and required paid medical treatment they would need to pay, i feel this is a medical condition, brought on by engaging their services and they are responsible for most if not all of the costs of treatment incurred to me, as it is not something i should reasonably expect to be on the lookout for.  i can provide photos, but i would rather not, as lice are disgusting and i dont think any of us want to see that. if requested i will upload the ones i found in the uber however.  theres also the matter that a parasite that was sucking someone elses blood then came into contact with me and interacted with mine, though the chances of anything coming of that are minuscule, its still an additional reason as to just how disgusting this is.  Edit:There seems to be some debate as to me being a troll, i fucking wish i was. [I have heard uber called a lousy company, but this is literal.](https://i.imgur.com/JXZQqui.jpg)  [i apologise for the quality, but it was hard to get a shot, in a moving car, and i didnt want to touch the thing for long. my tablet camera is also so terrible it doesnt have flash.](https://i.imgur.com/oEToR1R.jpg)if requested ill see if i can yank a baby out of my head, but the ones i currently have are too small to be seen really, which is how i know i wasnt infected beforehand, i have not one adult lice and only a few larger than specs.  i would also love to know, just from curiosity, why people downvoted this, and why someone would think im a troll? i didnt even think of a pun until a day later thats how concerning this was to me, and im normally the first one with a pun, why would i troll this? what do i have to gain? ill openly state i intend to use it again, its a useful service, and just because some parasitic asshole decided he would spread that ""love"" doesnt mean im boycotting uber, i simply feel they should work with me for a solution to a lousy problem that reflects poorly on their health, safety and image, and makes me feel disgusting.  "
1,"4.76 Uber Rating- why?I cannot wrap my head around how Uber drivers rate their passengers. I just noticed my rating went down to a 4.76... I feel like I’m the ideal passenger. I’m always polite, punctual, and I always tip in cash. I have never made an Uber wait. If the driver doesn’t want to talk, I leave it at that. I had an Uber driver that needed to put air in his tire midway through our ride and I bought him a coffee while I waited. I still gave him 5 stars because I’m not a dick and I understand his job is reliant on his ratings.  It’s just frustrating that I feel I have to work so hard to please a service that I am paying for. The entire rating system is fucked. Can anyone help me understand what I need to being doing differently?"
0,"AMP no longer available in my city?Hello r/Lyft!  I checked my AMP status last night, and it said I needed 3 more rides.  I check today as I’m finishing my rides, and it says amp isn’t available in my city.  I’m driving in Albany, NY.  I know it’s abailable because I see dozens a night while driving. Any ideas? Thanks 🙏🏼 n advance"
