subreddit,text
1,Uber pax: Do you care what’s your driver’s rating is? 
0,"Terrible CS, permanently (?) disabled unused accountAs title says. I live in an area that didnt have functional Lyft for many years. I went on vacation, and attempted to use my unused Lyft account. After receiving an email to my email address asking me to write out my name and email address (full name is in email address 😂), I was told the following:  Hi there,      Thanks for following up! Legally, we cannot release any additional information except that we found your account to be violating our Terms of Service.      We will be in touch if we are able to reopen your account in the future.       Any suggestions? My phone number was ported from Google voice to Google Fi and shows up as a VOIP number on some platforms, but is my only cell phone number since I now use Google as a carrier. I believe the porting is even done through TMobile through an agreement Google has with them.       Could this be the issue? And if not, how can I appeal if they wont even tell me why it was disabled? Ive even sent a screenshot showing that Ive never before used Lyft.   Edit: to clarify, no Ive never used Lyft before. This is an entirely unused account. Also, support will no longer respond to me at all (😂)."
1,Must see video for both Pax and Uber Drivers. (Pax getting hit by car while getting into an Uber.) Always be safe people. 
1,"Letting drivers know about disabilitiesI love the service, but because I have disabilities that sometimes make talking to the driver difficult for me, am normally too anxious to use Uber.   There’s nothing on the accessibility pages about this very common issue. Is there any way of adding disability info to your profile for the driver? Can I send a message they will see before they pick me up?  Drivers, what would work best for you?  (Specifically for me, my condition varies from being able to have a conversation to just being able to do the basics of directions and pleasantries. Others may not be able to speak at all at times)"
0,"Rough night now lyft is threatening to suspend me , also they banned me for an hour "
0,1 star ratings with no commentsThey should remove these.  A 1 star and 59 5 stars and no comments on the why for the 1 star. 
1,"Rides near me arent getting pinged?Had this happen a bunch of times when trying to get to work, there will be an uber right down the road from me or in the area, and its the only one. But when I go to ping and hopefully get him to accept, it wont say a time and never seems to accept it. Just wondering if this is an issue caused by something or if its just the drivers not accepting it."
1,"Question for drivers about uber eats when we pre-tip - can you see the tip before you choose us?If so Id imagine people that tip would get their orders more quickly, particularly during busy times.     It seems like it would make sense because both drivers and customers would benefit but I know uber doesnt always do what makes sense... "
0,"Account deactivated after entering promo codesI recently made a new lyft account this morning and I tried to request a ride and then they told me to add another card with the same billing so I added my fathers credit card so they can activate my account then I deleted my fathers card so I wont accidentally use it. Then I added a gift card I won at school and then I tried to request a lyft and they told me I need to contact support and I did so, then they said they cannot reactivate my account and Im really confused as to why. I placed the promo into the account and now that my account is deactivated I cant use it and its very frustrating. Can someone give me some help ?  Thank you so much "
1,"""known for great conversation""...a silent Valentine to passengers from a driverInspired by this post:  [https://www.reddit.com/r/uber/comments/ap90by/feels/](https://www.reddit.com/r/uber/comments/ap90by/feels/)  My passengers have started bringing up that I am ""known for great conversation"" ....because 29 people out of 1,580 rides have given me a badge.  Most of my rides are quiet, and I like a good conversation every once in a while but not every rider! Its too much, too many of the same questions and answers. My throat starts hurting. Also I want to focus on the road, conversation can really be distracting at times. And Im an introvert, like roughly half of the drivers you will have. Your silence is not awkward, just say hello and do something on your phone. Or if you really want to talk, lead the way. Otherwise, this is my perfect ride:  \*Greetings fellow human, let me take you where you want to go!\*  ...music plays...  \*Ok, we are here! Live your best life, fare thee well! &lt;3\*"
0,"Scenario: John Doe hops in the car, you verify his name, start the trip. “Oh my buddies are coming too, they’ll be out in a minute” 5 minutes later...still waiting. What’s your move on a pax holding the car knowing you won’t get that extra $5 or waiting time? "
0,"An interesting fact for riders, its MY CAR! Deal with it! "
0,"Dropped off at airport. Ride didnt register as being finished and our driver proceeded to drive around - DOUBLING our fare!After reading some other stories here, I thought asking here may help as Lyft makes it impossible to talk to anyone. As the title suggests, our driver dropped us off and the ride didnt end until he continued to drive for miles.  This doubled our rate, leaving us with no recourse other than the customer service email. We were unable to do anything as we had to go through security screening.  /u/lyft I was hoping to find a way to talk to someone or further the request for review.  This only happened this morning, but sending an email and seeing if anyone had input here seemed like the best choice before reaching out via social media .  Has anyone had this happen before and how did you handle it? Thank you for reading."
1,"1st 1*Im only at 108 rides, but my 4.97 dropped to 4.90 in the last hour due to a 1* (I had three 4* and 68 5* previously), and it makes no sense.   Is there anything that can be done to contest something like this? It seems like they shouldnt allow such a low rating without any type of explanation.   Im sure this comes up a lot on here, so if anyone has a link to a previous thread that would be appreciated. "
1,Constantly being hit on by guys.Im a driver and usually when Im at the end of the trip and its a guy he will try and get me to come inside and gimme that I wanna suck yo dick look. Im flattered and all but Im not gay.  Why cant the ladies be more like gay guys? 
0,"Fair tip to a driver in snow? And is there more Lux or XL when in snow?Hi guys!  So I need to work early morning tomorrow and live about ten minutes away, less then 3 miles from here. No crazy hills or anything.  What’s a fair tip to a driver in the snow for such a short ride??  Also is there more XL or Lux drivers in the snow?  Thank you!"
1,Uber directing to me to toll roadsHi all.   So maybe I’m a little to new to this but here it goes:  So I was driving in Southern California where there are toll roads 241/261/73. The Uber app (mind you this was before picking up my passenger) told me to take the toll road to get to my passenger. After the ride I noticed that I wasn’t given a toll fee and I thought to myself I took the toll because the Uber app told me to take it. So here’s my issue.   1) why is uber telling me to take the toll road while knowing I will not be reimbursed for taking a toll on the way to pick up a fare.   2) if I take side streets (which I can program in another app like google maps) I can get there but if may take me 10 minutes longer. However Uber app is advertising I’ll be there in 5 minutes.   My problem is Uber advertising to you that you’ll be there in x amount of minutes because they directed you into a toll road that YOU’RE paying out of pocket. So is it possible they can add that option or by default leave the toll option OFF when picking up a passenger by default? 
0,"PlatepassWhere is the platepass transponder inside of the hertz vehicle, and can I remove it?"
1,"NOT TODAYHad an XL pick up , arrived to find 6 miscreants all with red solo cups in hand.   I showed down , kept on going, then canceled once I realized the situation.  Not on a Sat nite.  &lt;waves Diikembe Mutombo index finger ."
1,"Repeating receiptsI keep getting receipts for a ride I took last week. I’ve gotten about 10 emails so far about the same ride. The support hasn’t been very helpful, just says they’re looking into to. Anyone else have this issue?"
0,"We should all be thankful when we get a quick clean, safe ride. Tip your driver. Lets be thankful for what we consider small things that are priceless. "
0,"One dayUber, another Lyft, those are the days of our driver lives. And we deal with stuff like a Soap Opera. "
1,"1st Time app user.. question about tippingI had a minor emergency tonight and I had to use Uber while my car was stuck in a snowbank. I used the app for the first time. I was asking my best friend about it (we had to go back and forth to her house, she got one Uber I got the second) and she said she put in the tip when she ordered it, but she thought I could put one in after. I have looked all over the app and it did not give me an option to add in a tip, just charged me the amount it quoted me. I went back in after the ride and I can not find anywhere I can put one on it after the fact. I feel like a real asshole, the driver was really good. I would have tipped cash but because I was not expecting this to happen I had no cash on me."
1,"Add image verification for driver and passengerWhen you walk up to an Uber in a busy area(assuming it really is even an Uber) you should be able to ask the driver for a photo that either you select or Uber does that you know is true but no one else would.  The driver shows the photo to prove they are your driver.  The same for the reverse, if I have a car I want to know I have the right person and they can present the image on their phone screen.  "
1,Customer support??Does anyone know if Uber has a support number that isnt critical response? I just had an awful experience and had to cancel my trip and there is no way to contact any kind of support
0,Can I use Lyft for this?I need to get a wheel for my car from the auto-parts store back home.  Can I put a wheel in the trunk of a Lyft?  Edit: Followed advice below and driver was cool with it. Thanks!
0,Its gotten better! 
1,"Furious Over Falling Pay, Los Angeles Uber Drivers Prepare to Strike "
0,"Driver looking for help from other driversHi all. Ive been driving for lyft for about a year now and overall I really love the experience. Of course, its not without its fair share of headaches, slow days, and crazy passengers, but all in all its been a good experience. Ive enjoyed driving so much, in fact, that I decided to do my thesis project for college on rideshare companies and driver communities in particular.  A HUGE part of this project is research, and as part of that research, Ive put together a short survey, and I would be so grateful to ANY DRIVERS out there from this group who could take the time to complete it. The survey should take no more than 10 minutes to complete, and any answers given will remain completely anonymous and confidential. Lastly, one lucky participant will win a $25 gas card!  My goal is never to spam anyone in this group, but, rather, to get input from all of you so that I can learn more about what you love about driving, what you wish was different, what matters most to you and what keeps you coming back to Lyft and others. Ultimately, my goal is to use this research and findings to hopefully make all of our lives better as drivers.  Thank you all so much for your time. Safe Driving    [https://docs.google.com/forms/d/e/1FAIpQLSdaC7QxFSJb9DWh4T5BgpYPTUCxi12IaECLi-uxwfAurNydcA/viewform?usp=sf\_link](https://docs.google.com/forms/d/e/1FAIpQLSdaC7QxFSJb9DWh4T5BgpYPTUCxi12IaECLi-uxwfAurNydcA/viewform?usp=sf_link)"
0,Well i hope thsmis doesnt affect us drivers adversely. 
1,"Question to the drivers: Why drive in the snow if you are simply going to bitch about it?Long story short, I work at a VA hospital in the nursing department. AKA I HAVE to go to work, even when it snows. I dont drive and use Lyft/Uber daily... Today there was lake effect snow bands here in Erie PA https://imgur.com/gallery/81uuzxh So far maybe 8inches... Yes whiteout conditions, but again, the vets do need their meds and nursing staff... So I summon my Uber as usual and the gentleman that picks me up does nothing but complain the whole 10+minute ride about how he ""cant believe ppl choose to go out in this shit.."" and "" we drivers assume all the risks"" yadda, yadda, ect... Ect... 🙄 So I remain pleasant, stay quiet, only thanking him and telling him I appreciated his ride upon exiting when I also then tip him $10 in cash plus $10 in the app after the trip. https://imgur.com/gallery/hUkn2Im He rudely speeds away after dropping me off at my location, barely waiting for me to exit the vehicle... I 5 stard him and amply tipped him... But really? 🤔🤨🧐 Why drive in ""this shit"" is what lingered on my tongue the whole trip and what I held back asking him... Why choose to drive and then bitch about it? Cant you just turned off your app? I mean the drivers around me were aplenty, there wasnt even a surge despite the awful weather (which is why I tipped excessively, because I DO recognize and appreciate the risks you drivers take) but seriously... "
0,Thefuk? I notice the pink zones in San Diego (used to be prime time indicators) don’t have any primetime applied to the rides- are these just “busy indicators” now or is there a problem with the app? None of the ride requests in the pink areas have prime time on them... 
0,"Why can’t I find out how many total rides I have given?It used to be that when you got your weekly feedback it showed your total rides you have given, not just weekly totals. I was wondering if anyone knows how to get that information? Maybe 2 years ago I got a text saying I had given 10k rides ... since they gave people with 20K rides $10K  I wanted to see how close I was to getting the 20K rides. "
1,does uber have a record of me driving for them?I drove for uber a few years ago and am currently filling out my resume. If I put Uber on my resume and my prospective employer contacts them/looks me up will there be a record of me working?
0,"Lyft needs to stop allowing passengers to contact drivers after the transaction is overIn last week or so Ive had two passengers who I waited for past the required five minutes, attempted to call with no answer, and left. After I left, I begin receiving texts and calls from dummy phone numbers asking where I am and if I left. Its intrusive. The transaction is over, they didnt come to the ride they requested, and Ive moved on in exact adherence to Lyfts policies.   The only way a passenger should be able to reach out once they havent appeared for the requested ride is to Lyft support, not bombarding my personal cell phone for me to explain to them why I couldnt sit waiting for them while obstructing traffic for ten minutes. "
0,"[Downtown Minneapolis Only] 20$ creditAll Lyft users 21 and older can use code ""CAPTAINGAMEDAY"" each day Friday, April 5 through Sunday, April 7 from 7:00pm CDT to 3:00am CDT for any and all gameday travel. Each Lyft user using the code will be given a $20 credit toward a safe ride in the downtown Minneapolis area.    So since its a promotional pledge of up to $20,000, that means there is a limit to this deal."
1,"As an Aussie, I will never tip in AustraliaWhy has uber tried to essentially alter our non tipping culture by asking me to tip every trip?"
1,"Is booking an Uber from the website more expensive?My phone is out of commission for the next few days, so I pleased when I discovered you can still book an Uber ride off of their website. However I noticed that a trip that usually cost around $8-$10 was nearly $18! I looked into it and realized that a cancellation fee was being included into the total cost of the ride. Is this typical? Will they actually charge me the extra $5 cancellation fee?"
1,I was declined and now I cant use uberHey All  My card was declined.  Therfor one of my rides was not paid  I have enough funds there in my card and now whenever I try to pay that fair or get a new fair using my card It says there is a issue.  Anyone have a solution or know how to get in touch with uber ??!?!?  this is annoying
1,"Hows the market in the Hampton Roads, Virginia area?Hi everyone.  Im looking to get a second job to help pay my bills and I was curious as to how big the market is in the area and if its even worth signing up for it. Thanks in advance."
0,First time Lyft SharedLoved it. Ordinary fare would have been $20 but car pool fare was $10. Had a Chinese guy in the front passenger seat the whole time but he never said anything or looked up from his Pokemon game on his Huawei phone.  I had to wait 10min for a pickup but I think I’m going to use this option more frequently. 
0,"Convenient app crashGot a short ride to LAX a little while ago. Get to the terminal and drop off pax. End the ride and take my time pulling out because I’m usually rematched right away but the app gets stuck in the drop off screen. As soon as I leave the terminal,  the app miraculously comes back on. "
1,Why do you give a low rating to your driver?I need extremely honest rideshare passengers to give me reasons they give their drivers a 4 and below?
0,Sky Harbor waiting lotSo that notice of the new staging area has been out for a while.  But I see it moved over and the cones off to the side and drivers in the lot.  Are we supposed to be over there?  The app will only put me in queue if i go into the Madison lot.  What gives?
1,Uber charging passengers extra because the driver missed a turn/exit and caused the ride time to double?Has anyone else experienced this? Are drivers missing turns on purpose to increase their wages? I already knew going in that working with tradesmen and contractors such as Uber drivers can be shady. Obviously I decreased my default driver rating of 3 stars to 1 star (and did not tip).
1,"Pregnant Lyft driver brutally stabbed to death by passenger, unborn child dies: cops "
0,Almost an ordinary night. 
1,Uber XL rulesSo theres 6 of us waiting on a uber. I order an XL because I have 6 people....like people do. So I get a acceptance and it shows a Chevy Silverado and I know even the biggest Silverado can support the driver and five people. That is also only if he had a middle seat and no one wants to sit right beside the driver.....Im sorry.   So I check and find he is in fact a 4 seater Silverado. I cancel and try to get one several times and he continues to accept each time. I finally go up to him and tell him to stop and he tries to convince us to fit. He was an asshole about it and basically cussed me out and said he would report me for not taking his uber. He said I was discriminating against him. Anyway he finally leaves and I get an actual XL.  Is there a way to report him? I saved his info. Also is there not rules for the type of vehicle that can be listed as XL? I know all trucks can max fit 5 passengers.
0,How much does Lyft scooters get paid to pick up scooters in the streets? 
0,"just sayin ,if its hidden its not my faultif you have one of those cars where the back doors handle is hidden or camouflaged, its not my fault i assumed to open the front door."
0,Unionize for better wages! (Please sign up here if youre interested.) 
0,"10 commandments of LyftMaybe we as drivers and pax, should come up with something like that.   1. Be nice and want to work.  2. Order when ready as a pax. Sit in back unless necessary.  3. Don’t talk loud on phone.  4. Don’t be finishing a smoke as you enter.  4. Don’t backseat drive at the last second. If you know “lyft always .....” then prep your driver ahead of time.   5. Drive well and drive with intent and safety.   6. If you don’t like being a driver, don’t turn app on. You must like interacting with people. This applies to pax as well.   7. Left lane is passing lane.  8. 5 star every time for pax and driver unless something is actually, really wrong.  9. Tip. I mean wtf. If you have luggage. If driver has to wait. If it’s an airport or not, drivers historically are in a tipped position as long as they hold the standards.  10. DON’T BE A JERK.   That’s my jug list that I think will keep us all civil. "
1,"Why would my passenger rating suddenly drop so much?Hi all, just a couple weeks ago, my passenger rating was 4.95. Now, after about five or six more trips, its dropped to 4.85. Why would it drop so much so suddenly? Should I be concerned? I really havent changed anything from before, and Ive always been polite and never made the driver wait, if anything Ive gotten better at the last part by not requesting pickups at crowded areas where I have trouble finding them but rather walking a few blocks to a less crowded area. (You guys taught me to do that, so thanks.) Ive even cash tipped a couple times, which I almost never do but I happened to have cash on me which I usually dont, and I always at least tip through the app. Whats going on and should I be concerned about this?"
0,So today has been a fun day... 
0,"Uber is way better than Lyft; your thoughts?I worked both solo to see the difference before doing them both at the same time. Uber, for me, pays far more and the clientele is far better.     Lyft should put out a notice telling passengers to shower before hailing a ride; i have had some absolutely disgusting shop-lyfters stink up my car and I hate even using the app anymore.     And seeing the way they pay to get name-dropped in films is pretty pathetic. Everyone knows youre there; only the creepers seem to care."
1,"Unable to create a new accountAfter entering and validating my phone number, giving the full name, mail, and password, the android phone app asks again the number. It is an infinite loop. And the most funny part is the official Uber help forum:  https://imgur.com/a/8Al98h7  https://help.uber.com/partners/article/i-cant-create-my-account-----?nodeId=bd5ea4a7-bcdc-462a-b74d-a90dfdf81fad       "
0,"Lyft is acting fishy !!!yesterday (Friday March 1st), I started driving around 5:20 pm because Lyft sent me a streak bonus offer of $10 for 5 consecutive rides, after I completed the rides, I didnt receive any bonus, so I emailed them today, and sent them screenshots, and they said Ive cancelled a ride, which didnt happen. I cant physically prove it, but it seems like Lyft and Uber are pickpocketing their drivers whenever they can !!!  https://i.redd.it/40n9uejrwsj21.png  https://i.redd.it/0oj8njjrwsj21.png  https://i.redd.it/b964tjjrwsj21.png    https://i.redd.it/gqq2j338gtj21.png"
0,"Decided to try out being a driver because working at restaurants for long hours was stressing me out.I got stressed out working at restaurants with long hours and when I got calls for interviews from jobs I couldnt properly have a phone conversation while working at a restaurant.  I decided to try out being a driver...dont know if I will like it or hate it but if I can last at a deli and working long restaurant hours I imagine this will be like a vacation.  Im a person who doesnt like driving much so to conquer my dislike of driving I decided to start driving more. Has there been anyone who didnt like driving but started to be a driver, anyway and how did it go?"
0,"Cancellation questionSo I went to pick up a pax and they had a baby with them, but no car seat. I immediately cancelled the ride and told her that I couldn’t drive her baby without a car seat. She was pissed of course, but oh well. I was wondering though - is this something I should report to Lyft so the cancellation doesn’t count against me? And if so, how would I go about doing that? Thanks guys!   EDIT TO UPDATE: I contacted Lyft and they said I did the right thing. They aren’t counting anything against me, giving me a $5 cancellation fee, and contacting the pax to tell them that they can’t do that. Thanks guys!"
1,Soo... My Uber driver just started the trip and just kept going in circles and I couldn’t get to him for about 5 minutesI’m walking and he’s in a car so it’s difficult to catch. Like what the actual fuck.
