subreddit,text
1,"It took me 2.5 hours to get somewhere 20 minutes away, and the driver bitched to both me and another passenger by insisting we ""need to learn to use the app""Sorry for the length. TL;DR at bottom.    I had to get somewhere that was a 20-minute highway drive away. I go there a lot and always take Uber Pool, and also try to leave -1hr early in case other people get added to the trip. So 1hr before my appointment today, I requested a ride and was paired with Driver 1. But Driver 1 never drove towards me, and just sat in a gas station parking lot down the street for 27 minutes. I cancelled. Then I had to re-request, but by that time rush hour had hit and the price tripled. Now, because of that, I had to stick with Pool because the UberX price had become preposterous. Great.  Then I got paired with Driver 2 (a different person), and that person was also sitting in the SAME gas station parking lot for an extended period of time without driving towards me. Then Driver 2 cancelled. Then I got paired with Driver 3, who was over 20 minutes away from my location and already driving in the opposite direction on the highway. So Driver 3 understandably cancelled. Then I got paired with Driver 4 who picked me up.   But Driver 4 was an asshole.   I live in a city that can sometimes be confusing. So I had walked to a nearby building that wasnt busy and easier for a driver to both find and park in front of. But my driver still passed it 3 times. Okay I understand that mistakes happen. However. Where I was located is easy to find, I was the only one standing there, I had talked to her on the phone and described exactly where I was standing and what I was wearing, and I waved as she passed every time. She made eye contact with me every time. The third time I even stood in the street off to the side, so I could step forward a little bit as she approached, but she saw me and then pulled around me and drove past.   On the 4th time around, Driver 4 picked me up, but before I even said hello or had my seatbelt buckled, she was complaining about my pick up spot and blaming me because one of the roads she had to drive down on the way there was missing a street sign (like thats my fucking fault). She wasnt yelling, but she was being curt and talking down to me. I didnt respond to her. I just sat there silently.   Then we went to pick up the next PAX, and that PAX did the same thing I did. She lives somewhere that is hard to pull into, so she walked to a nearby restaurant and requested there in an effort to make a drivers job easier. We pulled into the restaurant parking lot, and you could see the PAX clearly standing there (looking down at her phone then up directly at the car, the only person outside, waving the car over, has a face that matches the profile picture). But Driver 4 still proceeded to drive in circles around this small parking lot, passing her over 6 times. Im not sure what was going on in her head, because that person was clearly who she was supposed to pick up. Driver 4 was also staring at her phone without looking up at the road at all, and driving past exactly where the app was telling her to stop.  Did her brain just flatline for a few minutes? Does she not have enough experience? Was she overwhelmed by driving in the city? Was something wrong that made her act so weird? I dont know. It was strange.    On the 7th time around, she picked up the other PAX. Then, just like she did to me, nastily complained about the pickup location being difficult (it wasnt). This PAX calmly defended herself, saying that she had actually walked to a place that was easier for an Uber driver to find and she was trying to wave her over the whole time. But the driver just cut her off dismissively, made an irritated noise, then ignored the PAX entirely.   We were all riding in awkward silence for a while, then out of nowhere Driver 4 loudly exclaimed that ""people like you all need to learn to use the app before you use it."" Neither of us bothered responding.   When all was said and done and I arrived at my location, 2.5 hours had passed since I tried to request my first ride. It was far more expensive than I anticipated. Also keep in mind that I had walked to another building to request, so I was just standing in front of a random hotel for most of that time. Its cold outside.   I checked Driver 4s rating, and it was 4.59. I wonder why.   TL;DR Got a series of drivers who werent driving towards me or canceled, then was eventually paired with a driver who was acting weird and bitched at me and another PAX.   Edit: Typo in rating number. Adding a missing ""and"" to a sentence.  "
0,"An open letter to the passengers, from a Driver,Hey passengers,  I cannot stress this enough, but PLEASE report bad drivers you have experiences with.  Between this subreddit, some Facebook groups, and friends and family, I am always hearing about horror stories from bad drivers ranging from dangerous driving, to rude demeanors, and worse.  Many of our markets are over saturated with drivers, making the competition harder to compete with everyday.  It is no fair for the good drivers to have to compete with these kinds of drivers.    If a driver can’t be safe and courteous, then they need to find a different line of work."
0,The silent type...Love when they sit up front and dont say a word... On a 30 minute drive. I guess that beats them sitting directly behind me 
1,"Uber Promo Codes in QatarHello. Good day!  From September to January Uber has been sending me promo codes weekly but since 27th of January it hasnt been sending me anything but my friend still has been receiving the codes. Both of us use Uber regularly.     Just last week, I tried manually entering the code sent to him and it worked. And this new week I tried entering the new code and it says it is not valid"
1,"Gotta go back to Ubereats because my insurance doesnt allow rideshare.If I get in accident they will ban my Geico policy and other insurance may see that fact and it can affect me in future.  In my state all the insurance companies that offer rideshare wont take me due to lapse of insurance coverage, so until I stay at least 6 months with Geico I cant even go to rideshare insurance companies.  The beauty of UberEats is I dont need any decal or anything and unless I run over the person ordering the food, no one will know accident resulted during food delivery for Uber.  I wont ever have to do a claim under the Uber insurance even if something happens, I can simply claim under my own insurance and just say I was driving towards Cafe I go to or something if they ask me where I was going.  Do Holierthanthee woman you wont hear of any earnings and stuff from my UberX or Lyft anytime soon.  The driving actual people in Uber and Lyft pays well often, but I cant do it anytime soon any longer :("
0,"Car Stolen, tried to contact Lyft and there’s absolutely no way to do so...So I’ve been driving for Lyft for about a month or so. I woke up Sunday morning and found that my 2012 Acura MDX was stolen out of my parking garage right below my apartment...obviously that sucks.   Anyways, I wanted to contact Lyft to inform them because there are Lyft stickers affixed to the vehicle. I have no idea what nefarious activities this thief has planned for using the stolen vehicle but I wanted to let them know somehow that I no longer have possession of the vehicle. First, is this even necessary? I know they can’t impersonate me necessarily, but my car could be implicated in someway and fall back on me somehow, if it were used to commit a crime. Second, is there anyway to contact an actual person? I have tried to submit the information to Lyft and about the only way I can see to get the info to them is filing through the service animal complaint form. What the hell?"
1,Uber Deactivated my account?So I order UberEATS around twice a day and the past week restaurants have been messing up frequently. Now I complain cause this time they forgot everyone’s drinks and my mashed potatoes and they said they won’t be offering any compensation because of my refund history. Then I tell them how retarded that is “in a nice manner” and how it doesn’t matter how many times I complain if they messed up they messed up and I want my refund. They deactivate my account. Is there anything I can do?
0,Pax tried to scam out on a cancelAccepted a trip at a restaurant. Couple minutes away. Headed directly there. No issues. Pulled right in front sat for 30 seconds till i was blocking someone then pulled forward and was about 30 feet from the door. Almost 2 minutes in i get text from lyft that rider cancelled. Ok. Easy $5. Pull away and wait to see it register. Nothing. Check the trip info and see a message that rider cancelled and no fee because i wasnt making progress towards pickup. Wtf!  Immediately report on trip issue link. Theyve  indicated they rcvd my comment and will respond.    Lets see what happens.....
1,"How do uber drivers feel about picking up from the vet with post surgery dog?When I took him there, I let the uber driver know in advance I had a dog. I brought a blanket to cover the seat but the driver still seemed irritated. Now Ive got to get him after the surgery but he is in bad shape. He had some teeth and a large mass removed. Im just worried about getting a low rating or driver refusing to take me or charge me extra.   EDIT: thanks for these responses I was shy to post here since it seemed to be just for drivers, but you all responded in kind. My husband was able to leave work and get us, all is well but I will keep your advice in mind for the future. "
0,"Same request 6 timesIm a little frustrated with Lyft.  I had a ping for the same location 6 times, it was almost 20 mins away, and I refuse to go that far without compensation.  I accepted it twice, once on my own and one was added to my queue, then canceled as ""Pickup to far"", I declined it the other 4 times.  Why would they keep pinging keys for the same ride?  Im also not liking the auto queuing because it doesnt let you know how far the pickup is until you complete the other ride."
0,"Help with taxesI’m trying to help my boyfriend file his taxes. He drives with Lyft part time and made $2,000 last year. He didn’t receive at 1099 and we have no idea how to claim this income. He’s using turbo tax and all the answers on there are confusing and just saying we need a 1099, is this accurate? I’m sorry, we’re just confused and thought this sub may be able to help."
1,"Wow record blizzard earnings, 2.5 hours $131 in UberX tonight. Heading home now, pax were grateful I got them in extreme weather. "
1,"Uber gives us only 2 destination filters, but when I need 1 to take me home for end of night, I get this crap of not being able to do destination filter because of high demand area. So now I cant take people going my way to my house. "
0,Is the Lyft All Access plan a scam ? Enormous price difference between Lyft and Uber to the same destination from the same place. 
1,"Fraudulent rides causing me to be suspended??Has anyone else had to deal with Uber’s customer support team when handling fraud?  I was hacked recently. The hacker changed the number on my account to one with a Ukrainian country code (I’m in the US) and apparently took a ride or two on my dime.  My creditor charged back these charges, due to suspected fraud, and uber has since locked me out of my account. Now my account is being held until I pay what they are owed for the ride(s).  When dealing with the support team, I’m only able to get email support and it’s from a different member of the team with every single response. Since I can’t check my account (due to it being locked) I am just being spun around by the support team asked the exact same questions by a new person each time.  I’m getting frustrated and just want to ensure I’m not paying for fraudulent activity, but will happily pay for rides I’ve taken. Would love to get back to spending money with uber, but given the level of support, I am not seeing it in the cards right now..  Have any of you had a similar experience? Any advice on how I can get this resolved?  Edit: said supper instead of support, thanks Siri"
1,Discounts torontoAnyone else have the observation that they used to get discounts as a frequent user? I was getting 10% off sometimes pre 2019 stopped using for a while now I resumed being more frequent again and the discount s havent returned?
1,"Reminder: This sub is biased towards Uber drivers, not ridersPlease dont post any complaints that you have about any Uber drivers that you had or the people here will downvote you. Lots of posts here have comments with 0 or negative points. Reminder: the downvote button is a feature meant for posts that are irrelevant to the discussion, not a button for comments that you disagree with."
0,"Bay Area driver here. A passenger tried transporting a 3-4 gallon gas container for his sons scooter. I declined and cancelled the ride. Thoughts?When I pulled up for a ride for a woman, she texted me saying it was going to be for her husband who was trying to fill up a gas can for a scooter. I figure, okay. Scooters are small vehicles, maybe were talking a Walmart shelf-sized little container of gas. So I proceed to the pickup location, and a man comes out of the garage carrying a 3-4 gallon gas container and asks me if I’d like it in the trunk. In my head I’m like Hell No. So I had to break it to him and his son that there’s no way I can transport that for them, like what is this. If that thing spills in my car, I’m screwed. Best case scenario my car smells like gas for the rest of the day and I just made like $4 on that ride. So I happily cancelled the ride. What would you guys have done? Would you have made the little kids day by taking on this extra liability for presumably a ~$4 ride?   Also I don’t drive a beater, and would never transport gasoline for personal purposes in this particular vehicle. I have an older car for that. This is a 2017. "
0,IPO BonusI was told wed be getting the IPO bonus in the 19th and I havent gotten it yet was wondering if anyone on this sub has..
1,"Uber forced sign-off crap when trying to go home.I worked hard for Uber last night and five a lot of folks in bad storm weather yet come 9:30pm and Im trying to set Destination filter to only give me people heading towards my home, Uber sends tons of back to back pings that I cant even tap on the search icon for destination filter and when I ignore those pings, ban forced COMPLETELY signed out.  This forced sign out shit never happened prior to 2018 and Ive been driving since, 2015. Everytime this shit happens to me I just feel like throwing the phone out the window.  Isnt this class action lawsuit eligible?   I wouldve done destination mode to help them out, but because of that crap of sign-in me out and being asked for my login credentials, I got pissed and just went home. Whoever added this feature was pissed off with drivers for ignoring pings.  Sometimes we must ignore pings because we dont want someone to take us 1 hour away from where we live right when we are about to call it a  night (believe me that has happened to me before)"
0,My mother was charged $15 because SHE FOUND SOMEONE ELSES PURSESo the other day my mother was riding Lyft and she found a somebody else’s purse in the back seat. She promptly gave it to the driver so it could be returned. When she gets home it says that she was charged $15 and her own purse was found. That is not the case and Lyft has terrible customer service nobody responds to her emails she can’t find a phone number and what’s the concerning part is that I’m starting to think that driver kept the purse and just told Lyft it was my moms so she could take off with it. What are the options here because she absolute can not be charged for something she was never even involved in.
1,PoolCan the driver choose to dropp off second even if the my destination is first and closer? He passed right in front of my destination and I told him and he just kept going straight to drop off the other riders 
0,"Started driving two weeks ago. General questions.Im having a good time honestly. 160ish rides and Ive only had 2 hiccups. Im in a small, densly populated town surrounded by highways, so just sticking to my town usually nets me decent earnings. Bought an iPad Pro with my earnings from last week.  1. One thing Im having trouble with is sometimes Ill see the pickup pin and the little yellow figure sometimes a block or two apart. Most of the time Ill have no trouble just going to the pin but sometimes Ill go to the pin with the figure elsewhere and when I call them theyre in a completely different address. Do we go to the pin or the little yellow man?  2. Whats the most professional and practical way to throw someone out of your car for smelling like Shreks gooch mixed with weed?  3. Does acceptance rate actually matter? I keep reading a lot of drivers here saying  that it doesnt matter at all but in those Lyft tutorial courses they make it clear that youre allowed 15 cancellations for every 100 rides (or something like that) ask because there are parts of a neighboring town I would rather avoid. Also, I dont like doing shared rides but it also seems that the people requesting shared rides also dont like sharing rides even though theyre choosing to request a shared ride.  4. Is there absolutely no way to know where a passenger is going until you pick them up?  5. Only happened once. Accidentally hit arrived for a passenger added to my queue at the airport even though I wasnt at their terminal. The way the local airport is set up is each terminal has 3 floors. If youre on a different floor and you get hailed, you have to loop all the way around. Is there away to unmark yourself as arrived and go back to navigation?  6. Surprisingly Ive only had 4 drunk passengers, and 3 of them asked me to stop at McDonalds or something. I refused all 3, told them Im only taking them to their final destination. Im within my right to do so right?"
0,"ow boy ow boy. thanks for this offer lyftlyft  is now giving us horrible bonuses .  this is like the old days.  you work for a company and you get paid  you can only spend the cash in lyft stores.  the stores will cost the most and profit major cash.     here is the great offer from lyft.  thanks lyft when should i use this ?    Youre eligible to earn travel credit this month with Lyft. Starting today, for every 2 qualifying airport rides you take, youll get $5 in Lyft credit — up to $30 total. Offer available through April 30. See below for details.    screw your bs give us drivers an actual bonus we can use.  i just bashed lyft on twitter on this trash bonus "
0,Rider demanded I wait 20 min so she can keep warmi had rider which I drove for 30 mjn and she was sleeping the entire time the. When I got to her address she was telling me that her husband wont be there for another 20 min and has the keys to the house and wanted me to just wait and After I said I am not being paid for waiting she is like I will tip you 5$ and when I was thinking about it i got another call added to my queue and told her I have tor roll to that call and she got really mad and threatened to one star me and report me to lyft at that point I told her to exit my car and left and immediately Called lyft critical response line and explained the situation to cover my own ass riders are abusing drivers this needs to stop 
1,Uber fixed the drivers being able to see customers real phone numbers issue. Ahhh that $500 hit the spot. 
1,Uber Los Angeles Geography BoundariesI’ll be starting Uber X soon and was wondering how far out I can drive. I’ve heard I can get rides to San Diego. That’s fine if it happens but will I be able to get work out there or do I need to come back to work?  Will I be able to work as far west as Santa Barbara? How far east as in Inland Empire?  Further? Basically what are the boundaries for me to work?
0,Adding car/gig carHow long did it take for your car to be approved by lyft when you sent it through?  Has anyone used programs like gig ride or turo? 
1,Teach me to UberUber just launched in my city last week. Ive never taken an Uber. What do I need to know?
0,Wear your mother f***ing seatbelts. 
1,I dont want to hear about Jesus for my 30 minute trip.I took an Uber in San Antonio yesterday. The driver asked me if I was a man of faith? I said no. The rest of the ride he tells me how Jesus can help me. Ive never rated anyone below 4 stars before this. Please do not do this to your passengers.  Edit: Uber gave me a 7 dollar credit and wont pair me with him again
0,Cancellation Fee DisasterI’m driving in Atlanta. Show up at location and waited 5 minutes. At 5 minutes passenger calls me and yells at me and tells me I got there too quick. Tells me I need to wait for her to finished her dinner. She the walks back into her house. I cancel and Lyft doesn’t give me a cancellation fee. Lyft rep says there is a new Lyft policy. That if passenger calls me first then I can’t say it was no show. Is he full of shit or is this true?
1,"Has anyone else had an Uber driver who was clearly not licensed and here on a tourist visa?Ive had several, some who were quite open about it and drove fine. Yesterday my driver was Pakistani, spoke zero english, and who had clearly never driven before. He came to a full stop at the end of the highway onramp instead of merging and would not go over 45mph on the highway with cars zipping all around us. It was one of the most terrifying experiences of my life, and I have had many.   When I called the emergency line it had a message and it is a message basically telling you they do not take phone calls. When I wrote a text complaint they gave me my money back. wtf? Its like Russian roulette. How do they think they will get away with this?"
0,"I try to be helpful when I can, but....We as drivers make shit money sometimes. And we do not get paid enough to help you haul your groceries, wether its a few items, or two months worth of food and supplies. Now, if you felt like handing me a generous tip, that might be another story, but when you stand behind my car waiting for me to load my trunk with you groceries, youre expecting way too much. Sorry, but not sorry."
0,Mechanics of finding passengersWhat is the range for finding a passenger?  Do you have to be parked?  Are drivers picked in a sort of order if there are multiple in range?  Are airports worth it?  
0,Lyft or Uber IPOIs anyone thinking of buying shares once Lyft or Uber IPO is released? If so which one and why?
1,"Family member got sent Uber driver decals under their name, but they never signed up for Uber.Hey all, as the title states a family member got a letter addressed to them with Uber decals as if they had signed up to be a driver when in reality they have never even used Uber’s service before. I am trying to contact Uber and speak to a customer service rep but it seems to be damn near impossible. What are some of my options given this might be a possible case of identity theft? "
0,"Lyft RoadtripI’m taking a short trip from Phoenix, AZ to Las Vegas, NV. Does anyone know if there’s a good way to plan a trip and pick up passengers on the way that might be interested in long distance rideshare? "
1,"Crowded pickup locations, what to do?what to do if there is no room to pick up passenger (no where to park safely to get them)?"
1,"Virtual Account numberDoes Uber allow using virtual account numbers to pay for rides? I have used Google Pay for a long time without any issues and now all of a sudden I get the dreaded ""Oops there is a problem.""  Emailing uber support feels like descending into Dantes inferno with cut and paste responses. I have already been through seven rounds of emails where they claim there is no issue with my account.    I would prefer not to put my credit card number and my credit card company allows me to generate virtual account numbers. Has anyone else used virtual credit cards to make payments on their uber account?    Thanks"
1,Things look good for SF Supervisor Peskin’s deal to add tax to Uber and Lyft rides 
0,"Lyft Pass Purchase MistakeI accidentally ordered the 300$ all access pass on my account after a push notification showed up on my phone while I was waiting for a ride. I thought it was asking me to confirm my payment method, so I confirmed and was picked up.   The thing is I cant afford this pass and took a ride immediately after that same ride to pick someone up.   I only just found out after checking my bank statement that I have been charged for this amount. Would it be possible to receive some sort of refund for this despite the terms saying otherwise? I am considering disputing this with my credit card and risk the possibility of not using this service again  Any advice here? Is there a number that lyft accepts calls at?  "
